{
  "version": 1,
  "scannerVersion": "1.1.0",
  "generatedAt": "2026-06-08T13:39:06.449Z",
  "root": "/Users/vcsm/Desktop/VCSM",
  "scanDurationMs": 6492,
  "confidence": "HIGH",
  "engineSecurityCount": 9,
  "data": {
    "version": 1,
    "generatedAt": "2026-06-08T13:39:03.725Z",
    "engines": [
      {
        "engine": "booking",
        "writes": 30,
        "rpcs": 0,
        "edgeFunctions": 0,
        "externalApis": 0,
        "riskTier": "HIGH",
        "surfaces": {
          "writes": [
            {
              "operation": "upsert",
              "schema": null,
              "table": "availability_rules",
              "rpc": null,
              "functionName": null,
              "function": "dalUpsertAvailabilityRule",
              "confidence": "HIGH",
              "evidence": [
                "Supabase write call extracted from AST"
              ],
              "owner": "engine:booking",
              "ownerKind": "engine",
              "appId": null,
              "root": "engines/booking",
              "feature": null,
              "layer": "dal",
              "path": "engines/booking/src/dal/availability.write.dal.js",
              "file": "engines/booking/src/dal/availability.write.dal.js"
            },
            {
              "operation": "upsert",
              "schema": null,
              "table": "availability_exceptions",
              "rpc": null,
              "functionName": null,
              "function": "dalUpsertAvailabilityException",
              "confidence": "HIGH",
              "evidence": [
                "Supabase write call extracted from AST"
              ],
              "owner": "engine:booking",
              "ownerKind": "engine",
              "appId": null,
              "root": "engines/booking",
              "feature": null,
              "layer": "dal",
              "path": "engines/booking/src/dal/availability.write.dal.js",
              "file": "engines/booking/src/dal/availability.write.dal.js"
            },
            {
              "operation": "delete",
              "schema": null,
              "table": "bookings",
              "rpc": null,
              "functionName": null,
              "function": "dalDeleteBooking",
              "confidence": "HIGH",
              "evidence": [
                "Supabase write call extracted from AST"
              ],
              "owner": "engine:booking",
              "ownerKind": "engine",
              "appId": null,
              "root": "engines/booking",
              "feature": null,
              "layer": "dal",
              "path": "engines/booking/src/dal/booking.write.dal.js",
              "file": "engines/booking/src/dal/booking.write.dal.js"
            },
            {
              "operation": "insert",
              "schema": null,
              "table": "bookings",
              "rpc": null,
              "functionName": null,
              "function": "dalInsertBooking",
              "confidence": "HIGH",
              "evidence": [
                "Supabase write call extracted from AST"
              ],
              "owner": "engine:booking",
              "ownerKind": "engine",
              "appId": null,
              "root": "engines/booking",
              "feature": null,
              "layer": "dal",
              "path": "engines/booking/src/dal/booking.write.dal.js",
              "file": "engines/booking/src/dal/booking.write.dal.js"
            },
            {
              "operation": "update",
              "schema": null,
              "table": "bookings",
              "rpc": null,
              "functionName": null,
              "function": "dalUpdateBookingStatus",
              "confidence": "HIGH",
              "evidence": [
                "Supabase write call extracted from AST"
              ],
              "owner": "engine:booking",
              "ownerKind": "engine",
              "appId": null,
              "root": "engines/booking",
              "feature": null,
              "layer": "dal",
              "path": "engines/booking/src/dal/booking.write.dal.js",
              "file": "engines/booking/src/dal/booking.write.dal.js"
            },
            {
              "operation": "delete",
              "schema": null,
              "table": "location_members",
              "rpc": null,
              "functionName": null,
              "function": "dalRemoveLocationMember",
              "confidence": "HIGH",
              "evidence": [
                "Supabase write call extracted from AST"
              ],
              "owner": "engine:booking",
              "ownerKind": "engine",
              "appId": null,
              "root": "engines/booking",
              "feature": null,
              "layer": "dal",
              "path": "engines/booking/src/dal/location.write.dal.js",
              "file": "engines/booking/src/dal/location.write.dal.js"
            },
            {
              "operation": "insert",
              "schema": null,
              "table": "locations",
              "rpc": null,
              "functionName": null,
              "function": "dalInsertLocation",
              "confidence": "HIGH",
              "evidence": [
                "Supabase write call extracted from AST"
              ],
              "owner": "engine:booking",
              "ownerKind": "engine",
              "appId": null,
              "root": "engines/booking",
              "feature": null,
              "layer": "dal",
              "path": "engines/booking/src/dal/location.write.dal.js",
              "file": "engines/booking/src/dal/location.write.dal.js"
            },
            {
              "operation": "update",
              "schema": null,
              "table": "locations",
              "rpc": null,
              "functionName": null,
              "function": "dalUpdateLocation",
              "confidence": "HIGH",
              "evidence": [
                "Supabase write call extracted from AST"
              ],
              "owner": "engine:booking",
              "ownerKind": "engine",
              "appId": null,
              "root": "engines/booking",
              "feature": null,
              "layer": "dal",
              "path": "engines/booking/src/dal/location.write.dal.js",
              "file": "engines/booking/src/dal/location.write.dal.js"
            },
            {
              "operation": "upsert",
              "schema": null,
              "table": "location_members",
              "rpc": null,
              "functionName": null,
              "function": "dalUpsertLocationMember",
              "confidence": "HIGH",
              "evidence": [
                "Supabase write call extracted from AST"
              ],
              "owner": "engine:booking",
              "ownerKind": "engine",
              "appId": null,
              "root": "engines/booking",
              "feature": null,
              "layer": "dal",
              "path": "engines/booking/src/dal/location.write.dal.js",
              "file": "engines/booking/src/dal/location.write.dal.js"
            },
            {
              "operation": "insert",
              "schema": null,
              "table": "organizations",
              "rpc": null,
              "functionName": null,
              "function": "dalInsertOrganization",
              "confidence": "HIGH",
              "evidence": [
                "Supabase write call extracted from AST"
              ],
              "owner": "engine:booking",
              "ownerKind": "engine",
              "appId": null,
              "root": "engines/booking",
              "feature": null,
              "layer": "dal",
              "path": "engines/booking/src/dal/organization.write.dal.js",
              "file": "engines/booking/src/dal/organization.write.dal.js"
            },
            {
              "operation": "update",
              "schema": null,
              "table": "organizations",
              "rpc": null,
              "functionName": null,
              "function": "dalUpdateOrganization",
              "confidence": "HIGH",
              "evidence": [
                "Supabase write call extracted from AST"
              ],
              "owner": "engine:booking",
              "ownerKind": "engine",
              "appId": null,
              "root": "engines/booking",
              "feature": null,
              "layer": "dal",
              "path": "engines/booking/src/dal/organization.write.dal.js",
              "file": "engines/booking/src/dal/organization.write.dal.js"
            },
            {
              "operation": "update",
              "schema": null,
              "table": "organization_members",
              "rpc": null,
              "functionName": null,
              "function": "dalUpdateOrganizationMemberStatus",
              "confidence": "HIGH",
              "evidence": [
                "Supabase write call extracted from AST"
              ],
              "owner": "engine:booking",
              "ownerKind": "engine",
              "appId": null,
              "root": "engines/booking",
              "feature": null,
              "layer": "dal",
              "path": "engines/booking/src/dal/organization.write.dal.js",
              "file": "engines/booking/src/dal/organization.write.dal.js"
            },
            {
              "operation": "upsert",
              "schema": null,
              "table": "organization_members",
              "rpc": null,
              "functionName": null,
              "function": "dalUpsertOrganizationMember",
              "confidence": "HIGH",
              "evidence": [
                "Supabase write call extracted from AST"
              ],
              "owner": "engine:booking",
              "ownerKind": "engine",
              "appId": null,
              "root": "engines/booking",
              "feature": null,